[
  {
    "id": "1",
    "title": "IBM Cybersecurity Analyst Professional Certificate",
    "issuer": "IBM",
    "date": "Jul 2, 2026",
    "category": "Cybersecurity",
    "skills": [
      "Penetration Testing",
      "Threat Hunting",
      "Incident Response",
      "Digital Forensics",
      "Generative AI",
      "CompTIA Security+ / CySA+ Prep"
    ],
    "image": "IBM Cybersecurity Analyst.png",
    "url": "https://coursera.org/verify/professional-cert/23EHCOD97GM5"
  },
  {
    "id": "2",
    "title": "Penetration Testing, Threat Hunting, and Cryptography",
    "issuer": "IBM",
    "date": "Mar 23, 2026",
    "category": "Cybersecurity",
    "skills": [
      "Ethical Hacking",
      "Threat Hunting",
      "Cryptography",
      "Penetration Testing"
    ],
    "image": "Penetration Testing Threat Hunting and Cryptography.png",
    "url": "https://coursera.org/verify/TWNU7CJV4YTV"
  },
  {
    "id": "3",
    "title": "Cybersecurity Architecture",
    "issuer": "IBM",
    "date": "Feb 19, 2026",
    "category": "Cybersecurity",
    "skills": ["Architecture", "CIA Triad", "Governance", "Risk Management"],
    "image": "Cybersecurity Architecture.png",
    "url": "https://www.coursera.org/account/accomplishments/verify/EBW3CRFP2I8E"
  },
  {
    "id": "4",
    "title": "Computer Networks and Network Security",
    "issuer": "IBM",
    "date": "Jan 28, 2026",
    "category": "Networks",
    "skills": [
      "TCP/IP",
      "DNS Security",
      "Routing & Switching",
      "Firewalls",
      "VPN"
    ],
    "image": "Computer Networks and Network Security.png",
    "url": "https://coursera.org/verify/professional-cert/23EHCOD97GM5"
  },
  {
    "id": "5",
    "title": "Operating Systems: Overview, Administration, and Security",
    "issuer": "IBM",
    "date": "Jan 15, 2026",
    "category": "Systems",
    "skills": [
      "Linux OS",
      "POSIX Administration",
      "Process Isolation",
      "System Hardening"
    ],
    "image": "Operating Systems: Overview, Administration, and Security.png",
    "url": "https://coursera.org/verify/professional-cert/23EHCOD97GM5"
  },
  {
    "id": "6",
    "title": "Database Essentials and Vulnerabilities",
    "issuer": "IBM",
    "date": "Dec 18, 2025",
    "category": "Systems",
    "skills": [
      "SQL Injection",
      "Database Hardening",
      "Access Controls",
      "Relational Integrity"
    ],
    "image": "Database Essentials and Vulnerabilities.png",
    "url": "https://coursera.org/verify/professional-cert/23EHCOD97GM5"
  },
  {
    "id": "7",
    "title": "Cybersecurity Tools & Cyberattacks",
    "issuer": "IBM",
    "date": "Nov 20, 2025",
    "category": "Cybersecurity",
    "skills": [
      "Wireshark",
      "SIEM",
      "MITRE ATT&CK",
      "Attack Vectors",
      "Incident Triage"
    ],
    "image": "Introduction to Cybersecurity Tools & Cyberattacks.png",
    "url": "https://coursera.org/verify/professional-cert/23EHCOD97GM5"
  },
  {
    "id": "8",
    "title": "IoT Wireless & Cloud Emerging Technologies",
    "issuer": "Yonsei University",
    "date": "May 25, 2025",
    "category": "Networks",
    "skills": [
      "Telecommunications",
      "Network Architecture",
      "IoT",
      "Cloud Computing"
    ],
    "image": "IoT (Internet of Things) Wireless & Cloud Computing Emerging Technologies.png",
    "url": "https://www.coursera.org/account/accomplishments/verify/QH4JCLEFWJYA"
  }
]
